title,authors,publisher,publishedDate,description,genre,pageCount,averageRating,review_count,price,currency,language,popularity_score
Satyajit Ray: An Intimate Master,Santi Das,Allied Publishers,1998-10-16,"Satyajit Ray: An Intimate Master is an invaluable sourcework for studies in the work of Satyajit Ray and offers fascinating reading at the same time. Specially commissioned articles by experts and some of Ray's closest associates, relations and friends provide insights into the entire range of the creativity of Satyajit Ray, one of the world's greatest filmmakers—as artist and designer, writer, and filmmaker—and the environment that nurtured him. The contributions unravel features never before touched—upon all those subterranean elements that went into the making of his films and his artistic character. They should serve to open up new approaches to and possibilities for fresh readings of Ray's works in fiction, design and filmmaking alike. The 400-odd illustrations—several of them appearing in print for the first time—bring together a wide range of film stills, working stills, book illustrations, early drawings and sketches, layouts for advertisement insertions, film posters, brochures, portraits, caricatures, jacket designs, giving viewers a rare chance of studying the entirety of Ray's visual imagination and artistic craftsmanship. The memoiral, and analytical and critical pieces are supplemented by a comprehensive and thoroughly authenticated documentation, covering Ray's biography, a chronology of his films, filmography, synopses and cast/credits, awards and honours, his contributions to works by others, discography, bibliography, citations received on several occasions, the text of his earliest literary work, reproductions of his earliest artistic works, and portfolios on the making of Pather Panchali, his masterwork, and his involvement with Sandesh, the popular children's periodical launched by his grandfather that Ray revived in 1961, from a passionate concern for the enlightenment of children, a project that grew to be a passion of his in his last years. A selection of reviews of Ray’s films, national and international, arranged chronologically and filmwise offer a record of the world’s perception of and response to his films over four decades, in historical perspective. The volume as a whole, the product of several years’ research, has drawn on the rich collection of relevant documentary and archival material and memorabilia lying with the Ray family; and with the thoroughness that has gone into its documentation, it will be, for several years to come, the most authoritative and exhaustive and reliable work on Satyajit Ray.",Biography & Autobiography,354.0,0.0,0.0,10.54,USD,en,0.0
Handbook of Twentieth-Century Literatures of India,Nalini Natarajan,Bloomsbury Publishing USA,1996-09-09,"India has a rich literary assemblage produced by its many different regional traditions, religious faiths, ethnic subcultures and linguistic groups. The published literature of the 20th century is a particularly interesting subject and is the focus of this book, as it represents the provocative conjuncture of the transitions of Indian modernity. This reference book surveys the major regional literatures of contemporary India in the context of the country's diversity and heterogeneity. Chapters are devoted to particular regions, and the arrangement of the work invites comparisons of literary traditions. Chapters provide extensive bibliographies of primary works, thus documenting the creative achievement of numerous contemporary Indian authors. Some chapters cite secondary works as well, and the volume concludes with a list of general works providing further information. An introductory essay overviews theoretical concerns, ideological and aesthetic considerations, developments in various genres, and the history of publishing in regional literatures. The introduction provides a context for approaching the chapters that follow, each of which is devoted to the literature of a particular region. Each chapter begins with a concise introductory section. The body of each chapter is structured according to social and historical events, literary forms, or broad descriptive or analytic trends, depending on the particular subject matter. Each chapter then closes with an extensive bibliography of primary works, thus documenting the rich literary tradition of the region. Some chapters also cite secondary sources as an aid to the reader. The final chapters of the book address special topics, such as sub-cultural literatures, or the interplay between literature and film. A list of additional sources of general information concludes the volume.",Literary Criticism,451.0,0.0,0.0,81.0,USD,en,0.0
Nasrani Messiah,Santimon Jacob,Amor Dei,2025-03-08,"Nasrani Messiah: The Untold Story of an Ancient Jewish-Christian Legacy For centuries, a unique Jewish-Christian community thrived around the ancient city of Nineveh, preserving Israeli customs, traditions, language, and worship. Known as Nasranis, followers of Jesus the Nazarene, their identity became etched in history through the Arabic letter ""ن"" (Noon)—a symbol of resilience in a turbulent world. Nineveh, once the grand capital of the Assyrian and Babylonian empires, was where the Ten Lost Tribes of Israel were exiled. Centuries later, many of these exiled Israelites embraced the radical teachings of Jesus of Nazareth, forming a distinct community that upheld its Judaic heritage while adopting the Christian faith. Across the ocean, along the lush Malabar Coast of southwestern India, another group, the Nasranis of Malabar, emerged, mirroring the same customs, religious traditions, and language of devotion. Based on 12 years of extensive research, Nasrani Messiah draws from hundreds of historical sources, including ancient manuscripts in English, Aramaic, Arabic, and Portuguese. The author combines meticulous fact-checking, immersive fieldwork, and first-hand experiences living among Nasrani communities to present an unparalleled ethnogenetic study. This book explores how the Nasranis preserved their Jewish-Christian identity, maintaining traditions such as Pesaha (Jewish Passover), endogamous practices, and liturgical rites in Syriac and Aramaic—all despite Portuguese suppression at the Synod of Diamper, where they were labelled ""Sabbath-keeping Judaizers."" Blending history, genetics, culture, and theology, Nasrani Messiah challenges conventional Christian narratives and examines the Nasranis' connections to the Lost Tribes of Israel. With groundbreaking genetic research, the book reveals how modern DNA evidence links Nasrani ancestry to these ancient Israelite exiles. The author, an experienced journalist, presents these findings in an engaging and accessible narrative. Enhanced with maps and visuals, this book is more than a historical analysis—it is a gripping journey through the forgotten heritage of one of the world’s most intriguing religious communities.",History,418.0,0.0,0.0,6.49,USD,en,0.0
Directory of Indian Publishers,,Unknown,1997,Unknown,Booksellers and bookselling,268.0,0.0,0.0,0.0,Unknown,en,0.0
Voices of Change,"Akshaya Kumar, Amandeep Kaur",Springer Nature,2026-05-10,"This volume compiles critical essays that explore the evolution of progressive poetry in India from the 1920s onwards. It underscores the influence of writers in shaping both social and poetic landscapes, addressing themes such as folk music, colonial modernity, regional identities, and feminist poetics. Offering a comprehensive examination of the diverse voices and movements that have defined Indian progressive poetry, the book analyses key figures and movements, including Hemanga Biswas in Bengal, Subramania Bharati in Tamil Nādu, and the progressive cosmopolis in Assam. Additionally, it delves into the impact of film lyrics, the concept of autonomy in Telugu poetry, and the feminist poetics of progressive Punjabi poetry, explored alongside critical reflections on the cosmopolitan sensibility of poets such as Shiv Kumar Batalvi and Pash. The volume also includes a nuanced analysis of Gujarati poetry as featured in literary periodicals, the significant role of Tamil literary magazines, and contributions from Urdu, Hindi, Odia, Kannada, and Kashmiri literature, thereby highlighting the intricate tapestry of progressive thought across these diverse linguistic landscapes. By situating Indian progressive poetry within a global context, this volume provides valuable insights into how poetry has served as a medium for political and cultural resistance. With its interdisciplinary approach and thematic diversity, the book serves as an essential resource for scholars, activists, and students. It offers a nuanced understanding of the enduring role of poetry in shaping political ideologies and social thought in contemporary India.",Literary Criticism,411.0,0.0,0.0,169.0,USD,en,0.0
ILMP 2005,"Information Today, Incorporated",Unknown,2004,"For book publishing contacts on a global scale, International Literary Market Place 2005 is your ticket to the people, companies, and resources at the heart of publishing in more than 180 countries worldwide-from Afghanistan to Zimbabwe. With the flip of a page, you'll find completely up-to-date profiles for more than 16,500 book-related concerns around the globe, including... 10,500 publishers and literary agents 1,100 major booksellers and book clubs 1,500 major libraries and library associations... and thousands of other book-related concerns-including trade organizations, distributors, dealers, literary associations, trade publications, book trade events, and other resources conveniently organized in a country-by-country format. Plus, ILMP 2005 includes two publisher indexes-Types of Publications Index and Subject Index-that offer access to publishers via some 140 headings. Additional coverage includes information on international literary prizes, copyright conventions, a yellow pages directory, and a worldwide calendar of events through 2010.",Language Arts & Disciplines,1846.0,0.0,0.0,0.0,Unknown,en,0.0
"Kerala, an Authentic Handbook",,Unknown,2010,Unknown,Kerala (India),416.0,0.0,0.0,0.0,Unknown,en,0.0
The History of Trade Union Movement in Kerala,K. Ramachandran Nair,Unknown,2006,"The work, a comprehensive documentation of the chequered history of the trade union movement in Kerala, is based on published and unpublished sources and reminiscences of senior union leaders. The book traces the early phase of the union movement in Alappuzha and its rapid spread and growth across the state. The close networking relationship between trade union centres and political parties is also critically traced in the book and it throws light on the emergence of pro-labour policies of the State, division and fragmentation of the union movement in recent times and public s changing perception of trade unions in society.",Business & Economics,660.0,0.0,0.0,0.0,Unknown,en,0.0
Manorama Year Book,,Unknown,2006,Unknown,India,1020.0,0.0,0.0,0.0,Unknown,en,0.0
International Literary Market Place,Information Today Inc,Information Today,2005-12,"For book publishing contacts on a global scale, International Literary Market Place 2006 is your ticket to the people, companies, and resources at the heart of publishing in more than 180 countries world-wide-from Afghanistan to Zimbabwe. With the flip of a page, you'll find completely up-to-date profiles for more than 16,500 book-related concerns around the globe, including... 10,500 publishers and literary agents 1,100 major booksellers and book clubs 1,500 major libraries and library associations... and thousands of other book-related concerns-such as trade organizations, distributors, dealers, literary associations, trade publications, book trade events, and other resources conveniently organized in a country-by-country format. Plus, ILMP 2006 includes two publisher indexes-Types of Publications Index and Subject Index-that offer access to publishers via some 140 headings. Additional coverage includes information on international literary prizes, copyright conventions, a yellow pages directory, and a worldwide calendar of events through 2011.",Language Arts & Disciplines,1846.0,0.0,0.0,0.0,Unknown,en,0.0
"My Sapphire-hued Lord, My Beloved!","Kulacēkarar, Suganya Anandakichenin",Ecole française d'Extrême-Orient,2018,Unknown,Tamil poetry,632.0,0.0,0.0,0.0,Unknown,en,0.0
Journal of Kerala Studies,,Unknown,2008,Unknown,Kerala (India),326.0,0.0,0.0,0.0,Unknown,en,0.0
Sangeet Natak,,Unknown,1995,Unknown,Aesthetics,172.0,0.0,0.0,0.0,Unknown,en,0.0
Who's who in India,,Unknown,1985,Unknown,India,476.0,0.0,0.0,0.0,Unknown,en,0.0
South Asian Writers in English,Fakrul Alam,Dictionary of Literary Biograp,2006,"Essays on South Asian writers in English from all parts of the subcontinent who share a common fascination with the English language. South Asian writing in English is thriving and worth reading and studying, either as a whole or separately as Indian, Pakistani, Sri Lankan or Bangladeshi literature. Discusses the fate of the English language after the British left South Asia and the exile's return to a country that has changed and the search for roots.",Biography & Autobiography,536.0,0.0,0.0,0.0,Unknown,en,0.0
Imagining Women's Social Space in Early Modern Keralam,J. Devika,Unknown,2002,Unknown,,64.0,0.0,0.0,0.0,Unknown,en,0.0
Reference India,Ravi Bhushan,Unknown,1995,Unknown,India,412.0,0.0,0.0,0.0,Unknown,en,0.0
Contemporary Poets,Tracy Chevalier,Saint James Press,1991,"Contains biographical entries, a list of separately published books, and an essay on each poet.",Biography & Autobiography,1310.0,0.0,0.0,0.0,Unknown,en,0.0
Christian Contribution to Indian Languages and Literatures,Va Jayatēvan̲,Unknown,1994,"Anthology of papers presented at a seminar held in Dhyana Ashram, Madras, between 28th-30th Jan. 1994.",Christianity in literature,244.0,0.0,0.0,0.0,Unknown,en,0.0
Reference Sources in Modern Indian Languages,Pitambara Padhi,Unknown,1994,Unknown,India,310.0,0.0,0.0,0.0,Unknown,en,0.0
Publishers' International ISBN Directory,,Unknown,2002,Unknown,International Standard Book Numbers,1596.0,0.0,0.0,0.0,Unknown,en,0.0
Library Science with a Slant to Documentation and Information Studies,,Unknown,1996,Unknown,Library science,490.0,0.0,0.0,0.0,Unknown,en,0.0
Lucknow Librarian,,Unknown,1994,Unknown,Libraries,180.0,0.0,0.0,0.0,Unknown,en,0.0
Cassell & the Publishers Association Directory of Publishing,,Unknown,1985,Unknown,Book industries and trade,332.0,0.0,0.0,0.0,Unknown,en,0.0
"The Acts and Decrees of the Synod of Diamper, 1599",,Unknown,1994,"Outline of the life of Saint Thomas Christians of India in the context of the Synod of Diamper, 1599; includes translation of the acts and decrees from Portuguese.",Kerala (India),222.0,0.0,0.0,0.0,Unknown,en,0.0
Indian Book Chronicle,,Unknown,1997,Unknown,India,974.0,0.0,0.0,0.0,Unknown,en,0.0
Library Science with a Slant to Documentation,,Unknown,1992,Unknown,Library science,250.0,0.0,0.0,0.0,Unknown,en,0.0
Famous India,,Unknown,1978,Unknown,India,426.0,0.0,0.0,0.0,Unknown,en,0.0
Documentation and Bibliographic Control of the Humanities in India,L. S. Ramaiah,Unknown,1992,The present work attempts for the first time to bring together at one place a number of articles concerning different facets of the humanities and discusses their importance in education and human development.,Reference,376.0,0.0,0.0,0.0,Unknown,en,0.0
Recent Indian Publications,,Unknown,1993,Unknown,India,116.0,0.0,0.0,0.0,Unknown,en,0.0
Concise Encyclopedia of Language and Religion,"J.F.A. Sawyer, J.M.Y. Simpson, R. E. Asher",Pergamon,2001-05-22,"This title provides the specialist and the general reader with accurate, up-to-date information on every aspect of the crucial interface between language and religion.",Language Arts & Disciplines,624.0,0.0,0.0,0.0,Unknown,en,0.0
"Masterpieces of Indian Literature: Annotated bibliography : additional pieces, 19 languages; Appendices",,Unknown,1997,Unknown,Indic literature,600.0,0.0,0.0,0.0,Unknown,en,0.0
We Dare the Waters,P. T. Mathew,Unknown,2001,"On the religious life of Mukkuvars of Vizhinjam, a Christian fishing community in South Kerala.",Christianity,236.0,0.0,0.0,0.0,Unknown,en,0.0
Industrial Economist,,Unknown,1976,Unknown,India,1186.0,0.0,0.0,0.0,Unknown,en,0.0
Buddhist Themes in Modern Indian Literature,"Shu Hikosaka, G. John Samuel, Can̲ārttanam Pārttacārati",Unknown,1992,Seminar papers.,Buddhism in literature,362.0,0.0,0.0,0.0,Unknown,en,0.0
Recent Advances in Marine Biology,P. S. B. R. James,Unknown,1986,Unknown,Marine biology,632.0,0.0,0.0,0.0,Unknown,en,0.0
Contemporary Poets,Thomas Riggs,"Detroit, MI : St. James Press",1995,Approximately 800 entries offer an impressive representation of living poets and invite you and your patrons to delve into an eclectic mix of remarkable talents. This fully revised 6th edition of Contemporary Poets responds to and studies transformations occurring in English-language poetry during the 1900s.,Biography & Autobiography,1368.0,0.0,0.0,0.0,Unknown,en,0.0
"Handbook Of Libraries, Archives And Information Centres In",Brij M. Gupta,Unknown,1996,Unknown,,410.0,0.0,0.0,0.0,Unknown,en,0.0
"Handbook of Libraries, Archives & Information Centres in India: Indian languages reference sources, bibliographical control & publishing industry",B. M. Gupta,Unknown,1984,A collection of essays about libraries and librarianship in India with information concerning computers and databases.,Archives,410.0,0.0,0.0,0.0,Unknown,en,0.0
Subject Index of Modern Books Acquired 1881/1900-.,British Museum. Department of Printed Books,Unknown,1927,Unknown,Subject catalogs,1586.0,0.0,0.0,0.0,Unknown,en,0.0
Subject Index of the Modern Books Acquired by the British Museum in the Years ...,,Unknown,1927,Unknown,,1588.0,0.0,0.0,0.0,Unknown,en,0.0
The Encyclopedia of Language and Linguistics,"R. E. Asher, J. M. Y. Simpson",Unknown,1994,Unknown,Language and languages,628.0,0.0,0.0,0.0,Unknown,en,0.0
Subject Index of the Modern Works Added to the British Museum Library,British Museum. Department of Printed Books,Unknown,1927,Unknown,Best books,1588.0,0.0,0.0,0.0,Unknown,en,0.0
"Accessions List, India","Library of Congress. Library of Congress Office, New Delhi",Unknown,1930,Unknown,India,1416.0,0.0,0.0,0.0,Unknown,en,0.0
Kerala History and its Makers,A. Sreedhara Menon,Unknown,1987,Unknown,Kerala (India),94.0,0.0,0.0,0.0,Unknown,en,0.0
Birds of Kerala,C. Sashikumar,Unknown,2011,Unknown,Birds,835.0,0.0,0.0,0.0,Unknown,en,0.0
Keralacharithram,A. Sreedhara Menon,Unknown,2007-01-01,On the history of Kerala.,Kerala (India),441.0,0.0,0.0,0.0,Unknown,ml,0.0
Classic Malabar Recipes,Faiza Moosa,D C Books,2013-02-27,A Cookery book about delicious Malabar Receipes,Cooking,128.0,0.0,0.0,2.65,USD,en,0.0
Tribal Health and Medicine in Kerala,N. Viswanathan Nair,D C Books,2008-01-01,Unknown,Medical anthropology,280.0,0.0,0.0,0.0,Unknown,en,0.0
Birds of Kerala Volume - 2,Multipe Authors,Unknown,2011,"This Book describes 453 species of birds, and an additional 49 species that could also occur occasionally as strays. This book provides information on the Ornithological history of Kerala, biographical notes of ornithologists who worked on the 'Birds of Kerala', as bird collectors or ornithologists, in the 19th & 20th centuries. It contains bibliography of almost all the published works on Kerala birds and also discusses on the ecological changes that Kerala underwent in the past century.",,87.0,0.0,0.0,0.0,Unknown,en,0.0
Kerala Charithra Padanangal,Velayudhan Panikkassery,Unknown,2007-01-01,Unknown,,148.0,0.0,0.0,0.0,Unknown,en,0.0
Birds of Kerala Volume - 4,Multipe Authors,Unknown,2011,"This Book describes 453 species of birds, and an additional 49 species that could also occur occasionally as strays. This book provides information on the Ornithological history of Kerala, biographical notes of ornithologists who worked on the 'Birds of Kerala', as bird collectors or ornithologists, in the 19th & 20th centuries. It contains bibliography of almost all the published works on Kerala birds and also discusses on the ecological changes that Kerala underwent in the past century.",,80.0,0.0,0.0,0.0,Unknown,en,0.0
Birds of Kerala Volume - 6,Multipe Authors,Unknown,2011,"This Book describes 453 species of birds, and an additional 49 species that could also occur occasionally as strays. This book provides information on the Ornithological history of Kerala, biographical notes of ornithologists who worked on the 'Birds of Kerala', as bird collectors or ornithologists, in the 19th & 20th centuries. It contains bibliography of almost all the published works on Kerala birds and also discusses on the ecological changes that Kerala underwent in the past century.",,83.0,0.0,0.0,0.0,Unknown,en,0.0
Aayirathonnu Ravukal (3rd edition),Muthukulam Sukumaran,D C Books,2009,Unknown,,198.0,0.0,0.0,0.0,Unknown,en,0.0
V T Yude Samboornakrithikal,Bhattathiripad V T,D C Books,2006,Unknown,,648.0,0.0,0.0,0.0,Unknown,en,0.0
Places of Worship in Kerala,,Unknown,19??,Unknown,,0.0,0.0,0.0,0.0,Unknown,en,0.0
Kottarathil Sankunni's Lore Legends and Folktales from Kerala,,Unknown,2020,Unknown,,599.0,0.0,0.0,0.0,Unknown,en,0.0
Arogya Nikethanam (4th edition),Tara Sankar Banerjee,D C Books,2006-07,Unknown,,368.0,0.0,0.0,0.0,Unknown,en,0.0
Bovine Bugles,V K N,D C Books,2010-01-11,"Bovine Bugles is the author's own English translation of his novel Aarohanam , which won him the Kerala Sahitya Academy Award. V K N was a path breaking and celebrated Malayalam writer, noted mainly for his high brow satire.",Literary Criticism,164.0,0.0,0.0,1.32,USD,en,0.0
Devil Mountain,Thampy Antony Thekkek,Notion Press,2020-06-27,"Bhuthatanukunnu, or Devil Mountain, is a small town in the central part of Kerala. There sits a small engineering college along with the precious memories of non-resident Indian, Ouso Joseph. Ouso is married and settled in California where he’s lived for 25 years. Despite his happy marriage and life in California, Osuo finds himself comparing his current life in the USA with his past life in India.",Fiction,163.0,0.0,0.0,3.0,USD,en,0.0
Trip to the Zoo and The Bee Story,Azad,Unknown,Unknown,Unknown,,0.0,0.0,0.0,0.0,Unknown,en,0.0
Saurayoodham,Biman Basu,Unknown,Unknown,Unknown,,0.0,0.0,0.0,0.0,Unknown,en,0.0
Triumph and Tragedy in Travancore,A. Sreedhara Memon,Unknown,2001,"Role and contribution of Sir Chetpat Pattabhirama Ramaswami Aiyar, 1879-1966, Diwan and legal advisor to ruler of Travancore State, in the making of modern Travancore during 1931-1947.",Travancore (India),448.0,0.0,0.0,0.0,Unknown,en,0.0
On Present (in/g) Histories,Sebastian Joseph,Unknown,2017,Unknown,India,910.0,0.0,0.0,0.0,Unknown,en,0.0
On the Banks of the Mayyazhi,"Eṃ Mukundan, Gita Krishnankutty",Unknown,2014,Unknown,Malayalam fiction,239.0,0.0,0.0,0.0,Unknown,en,0.0
English-English-Malayalam Little Dictionary,K. Ayyappa Paniker,D C Books,2002-10,( Current Imprint ),English language,476.0,0.0,0.0,0.0,Unknown,ml,0.0
The Tiger Charmer,Vinitha Ramchandani,D C Books,2009,When Neha was born everyone seemed pleased because she was fair and round as themoon. But soon Neha s mother grew alarmed because her baby took longer to speak andwalk like most human babies did. But that s not where Neha s peculiarities ended. Thelittle girl seemed more comfortable with animals than with humans. Then one day Nehadisappeared only to return with an odd story about healing a tiger.,,0.0,0.0,0.0,0.0,Unknown,en,0.0
Uroobinte Krithikal,Uroob,Unknown,2006-01-01,Unknown,,3000.0,0.0,0.0,0.0,Unknown,en,0.0
Andher Nagari,Shwetha George E,D C Books,2008-07,"Andher Nagari (the dark town) is ruled by the most foolish ruler Chaupat Raja, little wonder that the people in this townare also foolish. Govardhandas almost loses his life in this town full of fools, but his wise Guruji comes to his rescue.",,32.0,0.0,0.0,0.0,Unknown,en,0.0
Experiences and Perceptions,P. K. R. Warrier,Unknown,2004-01-01,"Autobiography of a communist activist and cardio-thoracic surgeon; with refernce to Kerala, India.",Communists,180.0,0.0,0.0,0.0,Unknown,en,0.0
Daivame Kaithozham,Pandalam Kerala Varma,Unknown,Unknown,Unknown,,88.0,0.0,0.0,0.0,Unknown,en,0.0
The Book of Exodus,V. J. James,Unknown,2024-12-10,"Considered one of the finest works in Malayalam literature, The Book of Exodus is a poignant and, at times, harrowing portrait of a rural community living in the backwaters of Kochi, Kerala. The protagonist, Kunjootty, is struggling to write a book of the same title, aiming to capture the stories of the natives of his village, Potta Thuruthu, the Isle of Reeds, untouched by the forces of modernization. As the mystery and tragedy of Kunjootty's own life become clearer, the narrative attains the proportions and complexity of an epic, where myths and legends are intertwined with reality, and where the past and present become indistinguishable from each other. Soon, all the intersecting stories of Kunjootty's friends and acquaintances start converging into the inexorable flow of time, characterized by the nameless river that runs alongside Potta Thuruthu. Originally published twenty-five years ago, this was V.J. James's debut novel, which won the DC Books Silver Jubilee Award in 1999 and garnered a wide readership in Malayalam over the years. This lucid and elegant translation by Ministhy S. brings it for the first time to an English readership, opening a window on a timeless classic of modern Malayalam literature that was more than twelve years in the making",Fiction,0.0,0.0,0.0,0.0,Unknown,en,0.0
Naalukettu (27th Edition),Vasudevan Nair M T,Unknown,2009-01-01,Unknown,,204.0,0.0,0.0,0.0,Unknown,en,0.0
"A Journey Through Time, 1857-2007","P. Sethuram, M. K. Das (Journalist), V. N. Venugopal",Unknown,2008,Unknown,Kerala (India),321.0,0.0,0.0,0.0,Unknown,en,0.0
