title,authors,publisher,publishedDate,description,genre,pageCount,averageRating,review_count,price,currency,language,popularity_score
Report of the Ecumenical Conference on Foreign Missions,,Unknown,1900,Unknown,Missions,490.0,0.0,0.0,0.0,Unknown,en,0.0
International Encyclopaedia of Indian Literature: Malayalam,Gaṅgā Rām Garg,Unknown,1987,Unknown,Indic literature,178.0,0.0,0.0,0.0,Unknown,en,0.0
"History of Malayalam literature (Malayala Sahitya Charitran, engl.) Transl. from the Malayalam by E.M.J. Venniyoor","P. K. Parameswaran Nair, E. M. J. Venniyoor",Unknown,1967,Unknown,,0.0,0.0,0.0,0.0,Unknown,en,0.0
"The Oxford India Anthology of Modern Malayalam Literature: Poetry, drama, and prose","P. P. Raveendran, G. S. Jayasree, Mini Krishnan",Unknown,2017,Unknown,Malayalam literature,0.0,0.0,0.0,0.0,Unknown,en,0.0
A perspective of Malayalam literature,Kesavapaniker Ayyappapanicker,Unknown,1990,Unknown,,144.0,0.0,0.0,0.0,Unknown,it,0.0
Nationalism and Social Change,K. K. N. Kurup,Unknown,1998,Unknown,Literature and society,142.0,0.0,0.0,0.0,Unknown,en,0.0
A Perspective of Malayalam Literature,Ayyappappanikkar,Unknown,1990,Unknown,Malayalam literature,168.0,0.0,0.0,0.0,Unknown,en,0.0
The Oxford India Anthology of Modern Malayalam Literature: Fiction,"P. P. Raveendran, G. S. Jayasree",Unknown,2017,Unknown,Malayalam literature,0.0,0.0,0.0,0.0,Unknown,en,0.0
Ten Women Writers of Kerala,Sreedevi K. Nair,SSS Publications,2012,Unknown,"Authors, Malayalam",32.0,0.0,0.0,0.0,Unknown,en,0.0
Blue Eclipse and Other Stories,Kakanadan,Harper Collins,2018-12-25,"Blue Eclipse is a collection of fourteen stories spanning George Varghese Kakanadan's career that let us catch a glimpse of the brilliance of one of the flagbearers of modernist Malayalam literature. If 'Blue Eclipse' is an untrammelled exploration of surreal ideas, 'Timeworn' is a simple tale of nostalgia that takes shape on a retired school teacher's last day of life. Through an artist torn between his search for enlightenment and the magic of his model's physical beauty, 'Sreechakram' reflects on the Hindu philosophies of dualism and non-duality, while 'Madness' and 'Sunshine' talk about sex and the power of women in completely different circumstances. At once powerful and beautiful, morose and terrifying, liberating and suffocating, this is a collection to savour.",Fiction,135.0,0.0,0.0,9.99,USD,en,0.0
The Oxford India Anthology of Malayalam Dalit Writing,"M. Dasan, V. Pratibha, C.S. Chandrika, Pradeepan Pampirikunnu",OUP India,2012-01-26,"With 55 selections from songs, poems, short stories, excerpts from novels, biographical sketches, plays, and critical writings, this volume represents the work of 36 writers and 19 translators. With all, save three, pieces specially translated for this anthology, the selections arranged chronologically present a worldview and vocabulary of the Dalit movement in Kerala built on rebellion and a struggle for identity and recognition.",Literary Criticism,0.0,0.0,0.0,0.0,Unknown,en,0.0
A Grammar of the Malayalam Language in Historical Treatment,Mikhail Sergeevich Andronov,Otto Harrassowitz Verlag,1996,Unknown,Language Study,216.0,0.0,0.0,0.0,Unknown,en,0.0
Influence of the Meghadūta on Malayalam Literature,K. P. A. Menon,Unknown,1972*,Unknown,,0.0,0.0,0.0,0.0,Unknown,en,0.0
Changampuzha,Es Guptannāyar,Sahitya Akademi,2001,"On the life and works of Caṅṅampul̲a Kr̥ṣṇapiḷḷa, 1911-1948, Malayalam poet.",MALAYALAM LITERATURE-BIOGRAPHY.,76.0,0.0,0.0,0.0,Unknown,en,0.0
The Train That Had Wings,M. Mukundan,U OF M CENTER FOR SOUTH ASIAN STUDIES,2005-01-01,"The Train That Had Wings presents modern life in Kerala in terms of a shared but tragically compromised humanity. Mukundan dares to look beneath the routines and facades of everyday life in order to probe depth of sin, greed, and hypocrisy but also to rediscover what brings joy and hope. Sixteen short story translations and a critical introduction, offering examples of Mukundan's realistic, existentialist, psychedelic, and parabolic stories, show his range and talent for the very short story. If Hawthorne wrote “twice told tales,” Mukundan writes half-told tales, stories that jump in the middle, stomp around for just a minute, and leap away almost before the reader can settle in. Half-told, but a powerful and infectious half.",Fiction,147.0,0.0,0.0,0.0,Unknown,en,0.0
Social Novels in Malayalam,Verghese Ittiavira,Unknown,1968,Unknown,Malayalam fiction,100.0,0.0,0.0,0.0,Unknown,en,0.0
A History of Malayalam Metre,En. Vi Kr̥ṣṇavāriyar,Unknown,1977,"Includes notes on Malayalam, Kannada, and Telugu prosody.",Malayalam language,372.0,0.0,0.0,0.0,Unknown,en,0.0
Sociology Through Literature,S. Devadas Pillai,Taylor & Francis,2019-07-05,"This book presents a comprehensive study of nearly 100 of Kaaroor’s short stories. Kaaroor Neelakanta Pillai is one among the Big Six of the ‘new wave’ in Malayalam literature which began in the mid-1940s. The Big Six and their immediate followers wrote about the common man, peasants, pavement-dwellers, fishermen, rickshaw-pullers, underpaid school teachers — their lives, aspirations and vulnerabilities. By treating Kaaroor’s stories as case studies, the book takes a sociological approach to understanding the representation of a wide array of themes: romantic overtones, erotic pursuits, marital episodes, issues of family, lives of children, behavioural patterns, shades of greed, the idea of spirituality and politics in Malayalam literature. With its annotated transcreation and detailed commentary, this book brings Kaaroor’s works to the general reader, and will be useful to scholars and researchers of South Asian literature, English literature, linguistics, cultural studies, besides those interested in Malayalam literature and the Malayali/Indian diaspora across the world.",Social Science,213.0,0.0,0.0,59.99,USD,en,0.0
Kesari Balakrishna Pillai,K. M. George,Unknown,1989,Unknown,"Authors, Malay",112.0,0.0,0.0,0.0,Unknown,en,0.0
Malayalam (Indian Classics),S. GANESA AIYAR,Publications Division Ministry of Information & Broadcasting,2017-06-21,"The aim of publishing Indian Classics series was to make available the contents of all the classics of all Indian languages for everyone, irrespective of his/her mother-tongue. The present selection of compilation and abbreviation of the Classic in Malayalam has been accomplished by S. Ganesa Aiyar.",,201.0,0.0,0.0,0.0,Unknown,en,0.0
The Greatest Malayalam Stories Ever Told,A J Thomas,Aleph Book Company,2023-11-05,"The Greatest Malayalam Stories Ever Told is a collection of fifty brilliant short stories translated from the Malayalam. Selected and translated by poet, editor, and translator A. J. Thomas, this collection includes established masters such as Karoor Neelakanta Pillai, Vaikom Muhammad Basheer, Lalithambika Antharjanam, Ponkunnam Varkey, Thakazhi Sivasankara Pillai, S. K. Pottekkatt, Uroob, O. V. Vijayan, M. T. Vasudevan Nair, and Paul Zacharia, as well as accomplished new voices such as N. Prabhakaran, C. V. Balakrishnan, Aymanam John, Chandramathi, and others. 'The Farmer' by Thakazhi and 'The Speaking Plough' by Varkey deal with the trials and tribulations of village life. In Pilllai's story 'Wooden Dolls' and Kesadeva's 'The Oath', we encounter the seemingly simple, but intrinsically complex personalities of three rural women characters. In his classic story 'The World-renowned Nose', Basheer, the master satirist, resorts to biting satire to expose human vanity. In Antharjanam's 'Dhirendu Majumdar's Mother', the mother emerges as the revolutionary heroine of the Partition of 1947 and the Bangladesh Liberation War of 1971. 'Humans and Animals' by Nandanar narrates an unbelievably macabre incident from the horrors of Partition. In O. V. Vijayan's masterpiece, 'The Hanging', the reader is drawn into a father's sorrow over the death of his child. Madhavikkuty in 'Scent of a Bird' draws in bold strokes the existential angst of a modern woman who wishes to make a career for herself. P. Vatsala's story 'Pempi' describes the plight of Adiyar tribal women. M. T. Vasudevan Nair, in his celebrated story, 'Vision', underlines the freedom and liberated state of women choosing for themselves. 'Photo' by M. Mukundan is a harrowing story about child molestation. Zacharia, in his inimitable style, tells the story of an eccentric and reclusive masseur-physician who is challenged by a patient to heal her in 'The Garden of the Antlions'. Sara Joseph's 'Sweat Marks' shows how caste elites come together to dupe a brilliant Dalit student. These and other stories in this collection portray with brilliance and nuance the complex tapestry of the Malayali experience down the ages.",Fiction,0.0,0.0,0.0,0.0,Unknown,en,0.0
Aithihyamaala,Kottarathil Sankunni,Hachette India,2015-06-20,"This special e-edition combines all three print volumes of the collected enduring legends of Kerala in the Aithihyamaala, the garland of legends. Yakshis, gandharvas, gods and demi-gods. Famous poets and learned Ayurvedic doctors. Magicians, conceited kings and Kalari gurus. Faithful, intelligent elephants and their fatherly mahouts. A vibrant and diverse cast of characters brings to life the ancient stories. The original collection of 126 tales, were documented over 25 years and written in the 1900s by Kottaaraththil Sankunni. These stories of well-known figures in Kerala folklore were first published in Bhashaposhini, the renowned Malayalam literary magazine. This edition of 50 stories, meticulously curated and translated by Leela James, transports you to the magical world of history, myth and fantasy of more than 100 years ago. Wisdom and vice, revenge and loyalty, imagination and fact, faith and superstition are intricately intertwined to create a collector’s edition for lovers of legends, Malayalam folklore and Indian literature.",Fiction,341.0,0.0,0.0,4.99,USD,en,0.0
Interiorization,Ayyappappanikkar,Unknown,2003,With reference to modern Malayalam literature.,Malayalam literature,115.0,0.0,0.0,0.0,Unknown,en,0.0
Malayala Sahitya Charitram,,Unknown,1963,Unknown,,309.0,0.0,0.0,0.0,Unknown,en,0.0
A Comparative Study of English and Malayalam,"Tatta Kana¿ran, Joseph Muliyil",Hansebooks,2020-02-05,"A Comparative Study of English and Malayalam - as a guide to reciprocal translation for the use of upper secondary schools and colleges - Part II is an unchanged, high-quality reprint of the original edition of 1899. Hansebooks is editor of the literature on different topic areas such as research and science, travel and expeditions, cooking and nutrition, medicine, and other genres. As a publisher we focus on the preservation of historical literature. Many works of historical writers and scientists are available today as antiques only. Hansebooks newly publishes these books and contributes to the preservation of literature which has become rare and historical knowledge for the future.",,332.0,0.0,0.0,0.0,Unknown,en,0.0
Kerala Folk Literature,Chummar Choondal,Unknown,1980,Unknown,Folk literature,126.0,0.0,0.0,0.0,Unknown,en,0.0
Theeyoor Chronicles,N. Prabhakaran,Harper Collins,2021-04-21,"'A work of historic significance' - BENYAMIN A journalist goes to Theeyoor - 'the land of fire' - to investigate the unnaturally large number of suicides and disappearances in the city. After completing this project, however, Theeyoor refuses to leave his consciousness, and he decides to write its history. This history is told through various documents: the writer's notes, the anecdotes told to him while researching the suicides, Wardha Gopalan's book The History of Theeyoor, information provided by a local newspaper agent, personal papers of individuals, as well as some 'incidents' that the journalist himself imagines. In N. Prabhakaran's masterful hands - and in Jayasree Kalathil's brilliant translation - history, myth, facts, nature, political events, and everyday concerns of ordinary people weave together into a story that is at once local and universal.",Fiction,234.0,0.0,0.0,9.99,USD,en,0.0
O. V. Vijayan,"E. V. Ramakrishnan, K. C. Muraleedharan",Taylor & Francis,2024-12-16,"O.V. Vijayan (1930–2005) was an acclaimed Malayalam novelist, short story writer, cartoonist, translator, columnist, political analyst, and public intellectual. In a literary career spanning almost half a century, he published six novels, twelve volumes of short stories, eight volumes of non-fictional prose, three volumes of reminiscences, three volumes of cartoons, and four self-translations. This book offers a comprehensive understanding of O.V. Vijayan’s work by analysing his fictional and non-fictional works, cartoons, and columns, and situates him in the context of Malayalam literary culture and Indian literature at large. The volume discusses themes such as the politics of everyday life; culture, religion, and the changing nature of Indian society; struggles of a writer and thinker; the idea of socially responsive radical modernism; ecology and subculture; and the politics of self-translation. These readings explore Vijayan’s legacy as an iconic figure of modernism in Malayalam fiction who reinvented its language; as an unrelenting critic of the modern nationstate and its excesses; as a post-colonial thinker; and as a visionary who transcended the binaries of the mundane and the magical, the political and the spiritual, and the premodern and the postmodern. Part of the Writer in Context series, this book will be useful for scholars and researchers of Indian literature, Malayalam literature, English literature, comparative literature, postcolonial studies, cultural studies, global south studies, and translation studies.",Literary Collections,266.0,0.0,0.0,61.99,USD,en,0.0
Subversive Whispers,Manasi,Penguin Random House India Private Limited,2025-07-31,"Manasi is a stalwart of Malayalam literature. With her unparalleled feminist writing and powerful voice, she has mastered the art of telling radical short stories. Through Subversive Whispers, a collection of some of her best work, she continues to defy patriarchy, question Brahminical hegemony and push narratives that subtly yet fervently challenge the status quo. The book introduces readers to the irreverent 'Sheelavathi', which explores the Madonna-Whore complex in a uniquely local context, 'Devi Mahathmyam', which sheds light on the price that women pay for being goddesses in mere name and stories such as 'Spelling Mistakes', 'Square Shapes' and 'The Walls', all of which explore romantic love with a piercing realism. In stark and urgent murmurs that build up a fever pitch, these stories channel women's voices that open up their inner worlds, struggling to capture the minutiae of their suffering. It is this whisper-like quality of Manasi's storytelling that J Devika deftly conveys in translation, bringing the author's prose to the English reader in an incendiary collection that is sure to cast light on the darkened chambers of patriarchy and the hidden recesses of women's minds.",Fiction,115.0,0.0,0.0,0.0,Unknown,en,0.0
Oceaniayile Gumtree,Anil Konattu,Unknown,2017-06-04,"Migration is the part of the culture of Malayali community. Oceanayile Gumtree is a Malayalam Novel which tells us the story of some families who migrated to Australia. It explains about the social, cultural, financial and emotional shocks of migrants. the author carefully examines each character and present in a simple way. It is the story of the multi-dimensional characters present in the migration world. This book rich with events, humor, drama, and emotions.",Australia,141.0,0.0,0.0,0.0,Unknown,en,0.0
Malayalam Short Stories,South Asia Books,Unknown,1976-08-01,Unknown,,0.0,0.0,0.0,0.0,Unknown,en,0.0
Catching an Elephant and Other Stories,Eṃ. Ti Vāsudēvan Nāyar,Unknown,1991,Unknown,India,188.0,0.0,0.0,0.0,Unknown,en,0.0
Legacy of Kerala,A. Sreedhara Menon,D C Books,2010-07-12,"This work attempts to give a broad idea of the diverse aspects of the socio- cultural life of the people of Kerala in a historical perspective. Old traditions and new values in every sphere of human thought and activity have synthesized, assimilated and fused to form the history of Kerala.",History,92.0,0.0,0.0,1.32,USD,en,0.0
Content Resources for Assessing Mastery of Literature,"Pon Subbiah, M. Balakumar, Central Institute of Indian Languages",Unknown,2003,Unknown,Language acquisition,439.0,0.0,0.0,0.0,Unknown,en,0.0
Thakshankunnu Swaroopam,"UK Kumaran
Translated by: Jayasankar Keezhayi",Notion Press,2023-08-19,"In this era of rapid urbanisation, the provincial stories are forgotten. The provincial way of life is now limited to the literature. Only through creative imagination can we retrieve the provincial histories, otherwise lost forever. Thakshankunnu Swaroopam represents a sentimental blend of history, myths, and traditions. It reflects the lives of those who lived during a certain period in time, though not in existence anymore, through its interactions at various dimensions of politics, culture, and humanity. It shows the social renaissance movements and India’s freedom struggle defining its contours. That life is what Thakshankunnu Swaroopam has sought to capture for the generations to follow. A symbol of the bygone era. A tombstone. Review: “This is the story of people who lived at Thakshankunnu, situated in the Malabar region of present Kerala. The rich descriptions of villages, cities, romance, strife, and litigations combine to elevate this novel to an epic status. The novelist has succeeded in providing a distinct personality and individuality to Thakshankunnu, through the experiences of the people who lived there during its nearly a century-long era of social and political transformation. Here is another novel written entirely from the ambience of Kerala.” Prof. MGS Narayanan, Former Head, the Department of History, Calicut University, and former Chairman, the Indian Council of Historical Research. Awards received by the Malayalam version: Vayalar Award—2016, Kerala Sahitya Academy Award, Vaikom Chandrasekharan Nair Award, Bashir Award, Cherukad Award, Habeeb Valappat Award, Katharangam Award, Bhasha Institute Award, Abu Dhabi Malayali Samajam Award, P Kunhiraman Nair Award, Balyakalasakhi Award, Vidhya Vibhushan Award, Souhruda Sahithya Award, Namitham Award—2017",Fiction,452.0,0.0,0.0,2.99,USD,en,0.0
Kanneerum Kinavum,V.T. Bhattathiripad,OUP India,2013-02-28,"This celebrated work in Malayalam literature maps V.T. Bhattathiripad's transformation from a young boy schooled in his ancestral calling of priesthood to a radical writer and activist. Autobiographical in nature, the focus remains on the society as a whole and on the Namboodiri community in particular. The volume also includes an in-depth interview with the author and rare photographs related to the author's life and times.",Literary Criticism,0.0,0.0,0.0,0.0,Unknown,en,0.0
The Golden Goblet,Eṃ. Pi Appan,[Trivandrum?] : Appan,1976,Unknown,Malayalam poetry,86.0,5.0,1.0,0.0,Unknown,en,5.0
Beyond Kerala,"Nirmala Aravind, Prema Jayakumar",Unknown,2011,Unknown,Malayalam fiction,128.0,0.0,0.0,0.0,Unknown,en,0.0
Poovan Banana and the Other Stories,Vaikkaṃ Muhammad Baṣīr,Orient Blackswan,1994,"This carefully selected collection of Vaikom Muhammad Basheer s short stories are characterised by a variety in theme and tone. He has enshrined in them every kind of experience from the pangs of hunger and sex to the rapture of mystic vision. Its range includes stark realistic pictures of the material world as well as the realm of fantasy haunted by ghosts and spirits. Basheer has written on love and hate, on politicians and pickpockets, on the fancies of childhood and on the disillusionments of adult life with an intense sense of the tragedy of life and at the same time an irrepressible sense of humour.",Fiction,238.0,5.0,1.0,0.0,Unknown,en,5.0
Sugandhi Alias Andal Devanayaki,T.D. Ramakrishnan,Harper Collins,2018-07-25,"'Takes the Malayalam novel to new heights and fresh possibilities.' - The HinduWhen Peter Jeevanandam arrives in Sri Lanka to shoot a movie about a human rights activist ostensibly murdered by the LTTE, the government is more than willing to help. What they don't know is that he is also searching for Sugandhi - an LTTE member, and the love of his life.As Peter stumbles upon and becomes part of a plot to kill the president, reality, history, myth and fiction collide in explosive, illuminating ways.Sugandhi Alias Andal Devanayaki is a daring novel that portrays the violence inherent in both fascism and revolution.Winner of the 2017 Vayalar Award and the Kerala Sahitya Akademi Award.",Fiction,219.0,0.0,0.0,9.99,USD,en,0.0
"Sufi Authorship of Malabar. New Dimensions of Writing and Composing Poetry, Sufi Texts and Comics",Muhamed Riyaz Chenganakkattil,Unknown,2017-09-12,"Research Paper (postgraduate) from the year 2016 in the subject Literature - Comparative Literature, grade: A, Indian Institute of Technology, Delhi (Department of Humanities and Social Science), course: PhD, Religion and Literature, language: English, abstract: This paper deals with the Sufi authorship and new dimensions of writing and composing Poetry, Sufi texts and comics. Sufi authorship has different dimensions, ranging from writing or saying about mysticism, Sufi saints, or divine figures, in new forms of expression, such as poetry, graphic stories and Mushaira. While dealing with this in the tradition of Malabar's Sufi authorship, it is seen in its different nature. Malabar has contributed a lot to the tradition sufi poetry through Mala Poetry written in Arabic-Malayalam such Safala Mala, Muhyuddeen Mala, and poems recited in the mystical insanity. This Mala tradition has given a new facet of Sufi poetry. In this tradition, some Mala poetry has fixed single authors, and others still remain in anonymity of authors while others are shared and collaborative. Adding stories from Prophetic tradition and words of wisdom by Sufs in these poems seem to echo the intertextual and interauthorial aspects Frischkopfean notion of Sufi poetry. And questions arise from appropriating poems to a mad mystic who reached the circle of Jazb, whether his poem is part of his creativity or will it be treated as 'authorless' object due to its composition during one's Sufi madness. Impromptu Sufi poetry is mainly focus of some religious institute based competitions, which differs from the conventional system of Rekhtah/ Mushaira in which lines borrowed from the available Sufi poetry. In this impromptu poem, which is based on final letter of opposite contestant, the reciting person should create his own line from genius and perform it. The line should include some appraisal of prophet, or Sufi saints and it gives some important ideas on the original composition of the poems. Other",,16.0,0.0,0.0,0.0,Unknown,en,0.0
A.R. Rajaraja Varma,K. M. George,New Delhi : Sahitya Akademi,1979,"On A.R. Rajaraja Varma, 1863-1918, Malayalam and Sanskrit scholar.","Authors, Indic",84.0,0.0,0.0,0.0,Unknown,en,0.0
Navīnōttaranirūpaṇaṃ,E. Eṃ Uṇṇikr̥ṣṇan,Unknown,2015,Articles on 20th century Malayalam literature.,Malayalam literature,160.0,0.0,0.0,0.0,Unknown,ml,0.0
South Indian literature,Madhubālā Sinhā,Unknown,2009,Unknown,,0.0,0.0,0.0,0.0,Unknown,en,0.0
Mar̲aporuḷ,Rājīv Śivaśaṅkar,Unknown,2016,Unknown,Malayalam fiction,360.0,0.0,0.0,0.0,Unknown,ml,0.0
Kr̥ṣṇagātha,"Cer̲uśśēri, P. K. Śivasáṅkarappiḷḷa",Unknown,1985,Unknown,Krishna (Hindu deity),50.0,0.0,0.0,0.0,Unknown,ml,0.0
National Bibliography of Indian Literature: Malayalam,,Unknown,Unknown,Unknown,India,0.0,0.0,0.0,0.0,Unknown,en,0.0
Knit India Through Literature Volume I - The South,Sivasankari,Pustaka Digital Media,2024-05-23,"‘Knit India Through Literature...' is a mega literary project, first of its kind in Indian literature, is the result of the penance-yagna done for 16 years by Sivasankari, noted Tamil writer. 'Knit India Through Literature' has inolved intense sourcing, research and translation of literature from 18 Indian languages. The project she says aims to introduce Indians to other Indians through literature and culture and help knit them together. The interviews of stalwart writers from all 18 languages approved by the eighth schedule of Indian Constitution, accompanied by a creative work of the respective writer are published with her travelogues of different regions, along with an indepth article by a scholar on the cultural and literary heritage of each of the language, in four volumes - South, East, West and North respectively. Her travelogues, her interviews and the overview of each literature she has sought, all reveal one important unity... the concern our writers and poets express in their works for the problems that beset our country today. Through her project Sivasankari feels writers can make an invaluable contribution with their writings to change the thinking of the people and help eliminate those problems. In this volume ‘South’ she deals with four languages Malayalam, Kannada, Telugu and Tamil that are spoken in southern region of India.",Fiction,773.0,0.0,0.0,8.74,USD,en,0.0
Nāgārādhana Kēraḷattil,Si. Es Jayakumārikkuññamma,Unknown,2012,"Serpent worship in Kerala, a study.",Serpent,220.0,0.0,0.0,0.0,Unknown,ml,0.0
