title,authors,publisher,publishedDate,description,genre,pageCount,averageRating,review_count,price,currency,language,popularity_score
John O'London's Weekly,,Unknown,1921,Unknown,,0.0,0.0,0.0,0.0,Unknown,en,0.0
Apache Magic,Janis Reams Hudson,Diversion Books,2014-10-07,"“A novel to savor, a feast of realism, authenticity, and most of all, the magic and healing powers of love. Make room for Janis Reams Hudson on your keeper shelf.” — Romantic Times To the Apaches, Daniella Blackwood was an adopted daughter, respected and cherished. To their shaman, the bold white streak in her hair made her special and her visions in the flames make her a woman of magic. Yet no magic could protect Daniella from the passion that sears her senses when she first meets Travis Colton. To Arizona rancher Travis Colton, the mysterious Daniella is his only chance at rescuing his son. Travis and his ten-year-old son were captured by a band of Cochise's warriors. Left for dead, Travis managed to make his way home, determined to do whatever it takes to get his son back. Travis and Daniella's quest together will take more than magic; it will take a passion neither is ready to handle.",Fiction,466.0,0.0,0.0,0.0,Unknown,en,0.0
Current Index to Journals in Education,,Unknown,1997-04,Unknown,Education,1066.0,0.0,0.0,0.0,Unknown,en,0.0
Proud Eagle,Cassie Edwards,Signet Book,2004,"Makah Chief Proud Eagle has every reason to despise the Shaughnessys. Billie Shaughnessy's late father broke treaties, stole land, and caused the deaths of a number of the Owl Clan. They must find common ground before old hurts can be buried--and a mighty passion can take root. Original.",Fiction,340.0,0.0,0.0,0.0,Unknown,en,0.0
Racing Moon,Cassie Edwards,Signet Book,2003,"Commissioned to paint watercolors at a Louisiana cotton plantation, Irish artist Maureen O'Rourke spies Racing Moon, a chief of the Chitimacha. She longs to capture his beauty on canvas. But when the chief returns her admiration, their newfound passion ignites the rage of Racing Moon's bitterest enemy. Original.",Fiction,356.0,0.0,0.0,0.0,Unknown,en,0.0
New York Times Saturday Book Review Supplement,,Unknown,1968,Unknown,Books,938.0,0.0,0.0,0.0,Unknown,en,0.0
Contemporary Authors,,Contemporary Authors New Revis,2003-11,"These exciting and unique author profiles are essential to your holdings because sketches are entirely revised and up-to-date, and completely replace the original Contemporary Authors entries. A softcover cumulative index is published twice per year (included in subscription).",Biography & Autobiography,476.0,0.0,0.0,0.0,Unknown,en,0.0
Science-fiction Studies,,Unknown,1981,Unknown,Electronic journals,446.0,0.0,0.0,0.0,Unknown,en,0.0
Uniform Trade List Annual,,Unknown,1977,Unknown,American literature,2092.0,0.0,0.0,0.0,Unknown,en,0.0
That's what She Said,Rayna Green,Bloomington : Indiana University Press,1984,A collection of poetry and stories by sixteen Native American women authors.,Fiction,356.0,0.0,0.0,0.0,Unknown,en,0.0
Oklahoma Today,,Unknown,1998,Unknown,Oklahoma,1182.0,0.0,0.0,0.0,Unknown,en,0.0
A Study of Representative Indo-English Novelists,Uma Parameswaran,New Delhi : Vikas Publishing House,1976,"This Is A Critical Assessment Of The Contributions To Indo-English Writing Of Representative South Indian Novelists. The Novelists Are Divided Into Three Categories-The Imitators (T. Ramakrishna) Native-Talents Who Created An Indo-English Medium (R.K. Narayan), And Native-Aliens Who Became So Anglicized As To Alienate Themselves From The Heart Beat Of Indian Life. Raja Rao Comes In A Category All His Own One Who Realized The Full Of Potential Of Indian Writing In English.",Literary Criticism,194.0,0.0,0.0,0.0,Unknown,en,0.0
Clio,,Unknown,1988,Unknown,History,960.0,0.0,0.0,0.0,Unknown,en,0.0
Close Encounters with the Muse,Devarakonda Ramakrishna,Unknown,1986,Unknown,Indic literature (English),156.0,0.0,0.0,0.0,Unknown,en,0.0
The Indian Chief as Tragic Hero,Gordon Mitchell Sayre,Univ of North Carolina Press,2005,"Indian Chief as Tragic Hero: Native Resistance and the Literatures of America, from Moctezuma to Tecumseh",History,376.0,0.0,0.0,0.0,Unknown,en,0.0
Fire Cloud,Cassie Edwards,Unknown,2002,From the New York Times bestselling author of Midnight Falcon comes a new Indian romance set in the lush expanse of the Great Plains -an extraordinary tale of divided loyalties and passionate hearts...,Fiction,412.0,0.0,0.0,0.0,Unknown,en,0.0
Savage Shadows,Cassie Edwards,Leisure Books,1996,"In this classic Indian romance, Jae lives in seclusion in a mysterious region of Texas known as the Big Thicket. Even though she can outshoot, outwit and out-hunt most any man in the territory, Jae is alarmed by the dangerous desires a half-breed stranger arouses in her innocent heart.",Fiction,408.0,0.0,0.0,0.0,Unknown,en,0.0
Lakota Love Song,Madeline Baker,Price Stern Sloan,2002,Madeline Baker presents a new tale of two lovers-a young white woman and a fierce Lakota warrior-whose passion is threatened by the hostility and fear that is sweeping their land.,Fiction,356.0,0.0,0.0,0.0,Unknown,en,0.0
Radical Politics of Indian Love,Rachita Ramya,Unknown,2019-08-17,"'Radical Politics of Indian Love' is a collection of short stories of fiction in an Indian political landscape.India is a land of unity in diversity, organized chaos, but most importantly, India is a land of love. These bitter-sweet stories on how love co-exists in a backdrop of cultural differences, age-old traditions, honor-killings, and political dynamics can be inspirational and relevant. 'Treesome', 'Modern Indian Widow', 'The writer, the lover and the doctor' are stories of love that thrive in an era of conflict. 'No Man's Refuge' is a science-fiction story that touches on the future of the South Asian war zones.'The Bollywood Hero' and 'The Royal Bengal Tigress' are stories of romance and friendship that need to be told.",,150.0,0.0,0.0,0.0,Unknown,en,0.0
Forbidden Kisses in the Goddess Temple,Ramadevi Sharma,Unknown,2025-08-19,"Imagine your biggest concern as a temple acolyte is not getting caught stealing sweets from the sacred kitchen-until a cursed prince stumbles into your sanctuary in the middle of the night. That's how Anisha's problem begins. Or perhaps her adventure? As if hiding a sarcastic, ridiculously handsome royal fugitive weren't enough, Anisha must also deal with a terrifying curse that pulses beneath Ravi's skin in the form of dark veins. The solution? A breakneck journey through the jungle to a forgotten temple, accompanied by a palace servant-turned-spy and a mouthy street urchin. Between marketplace chases, palace masquerade balls, and trying not to get pelted by monkeys, Anisha and Ravi discover their greatest challenge might not be breaking the curse-but avoiding falling for each other. A story full of magic, self-deprecating humor, and the chaos that ensues when sacred vows meet royal intrigue. Perfect for fans of ""The Henna Artist"" and ""The Night Tiger.""",Fiction,0.0,0.0,0.0,0.0,Unknown,en,0.0
Legally in Love,Prasenjeet Kumar,Createspace Independent Publishing Platform,2018-07-24,"From the Amazon #1 Best Selling Author Prasenjeet Kumar comes his debut Legal Romance Novel that will bring a smile to your face and tears to your eyes. Meet Amit Verma, a 27 year-old dreamy corporate lawyer looking for a job in Delhi, India. One morning, while going through his mobile phone contact list, he comes across the entry for Naina Karnad, a girl who stole his heart some two years back in his former workplace. The problem: He has not dialled her number in a year. Will they ever meet again? Will their love life survive the corporate intrigues and the recession? ""Legally in love"" is a powerful tale of two souls battling their way through the ruthless world of corporate office politics to discovering their true love and passion. If you love reading clean and wholesome romance, buy a copy now. And enjoy!",,198.0,0.0,0.0,0.0,Unknown,en,0.0
Ten Western Romance Books (With Links to Free Audio Books),"Honoré Morrow, Grace Livingston Hill, Zane Grey, B.M. Bower, William MacLeod Raine, Elinore Pruitt Stewart",Sunsong Creations,Unknown,Unknown,Fiction,2875.0,0.0,0.0,0.99,USD,en,0.0
Savage Hope,Cassie Edwards,Unknown,2004,"A New York Times Bestselling AuthorWith help from the guiding beams of the local lighthouse, the Makah Indians of the Pacific Northwest made a successful living from the sea. Chief Bright Arrow was proud of the quiet, peaceful life he led with his people. But his idyllic world changed the day he passed by a frozen pond and saw a golden-haired angel dancing across the ice as if by magic - until, after a loud crack, the young woman fell into the frigid water.",Fiction,390.0,0.0,0.0,0.0,Unknown,en,0.0
Ram C/o Anandhi,Akhil P. Dharmajan,Harper Collins,2025-01-20,"Winner of the Sahitya Akademi Yuva Puraskar 2025 in Malayalam MOST ANTICIPATED ROMANCE OF 2025 Amazon India's Top 5 Most Anticipated Reads of 2025 300,000+ Copies Sold in Malayalam #1 Bestseller in Contemporary Indian Fiction First Time in English! THEIR STORY WILL STEAL YOUR HEART... When aspiring filmmaker Ram leaves peaceful Alleppey for bustling Chennai, he dreams of making movies and writing novels. Instead, he meets Anandhi. She's fierce. He's ambitious. She's a receptionist at his film school. He's the student who drives her crazy. Neither expects to fall in love. But as their hostility turns to passion, Ram and Anandhi face impossible choices. With social barriers, and their own fears standing in the way, they'll have to decide if their love is worth fighting for. Perfect for fans of: The Hating Game 2 States Pride & Prejudice Chennai Express Family Man A sweeping enemies-to-lovers story about dreams, destiny, and the courage to love without limits.",Fiction,297.0,0.0,0.0,0.0,Unknown,en,0.0
"Publishers' Circular and General Record of British and Foreign Literature, and Booksellers' Record",,Unknown,Unknown,Unknown,,1996.0,0.0,0.0,0.0,Unknown,en,0.0
Thunder Heart,Cassie Edwards,NAL,1999,"Against his will, Thunder Heart guided the Ponca tribe on a forced march from the Black Hills of South Dakota to a reservation in Missouri. Now, he must protect his people from whatever dangers await them in their new home... Against all odds, young Dede Martin thought she had found a good man to protect her fatherless boy. But she soon realises her mistake in trusting a man with hatred in his heart. For when he attacks the nearby Ponca, Dede and her son are kidnapped in revenge... Against her fears, Dede soon melts with passion for her captor, Thunder Heart, whose fierce anger gives way to blazing desire. He is a man whose strength brings her courage, a man whose heart is pure and true, a man whose love sets her free... 'Cassie Edwards once again shines as the master of Indian folklore, history, and romantic intrigue... A winner!' Rendezvous",Missouri,0.0,0.0,0.0,0.0,Unknown,en,0.0
Publishers' Circular and Booksellers' Record of British and Foreign Literature,,Unknown,1886,Unknown,Bibliography,1890.0,0.0,0.0,0.0,Unknown,en,0.0
Swift Horse,Cassie Edwards,Signet Book,2005,"After witnessing the murder of her parents by a on-eyed Indian, Marsha Eveland will never find forgiveness. But her brother announces he's going to marry an Indian woman. Can she keep hating the Indians or can she fall in love with one of them?",Fiction,338.0,0.0,0.0,0.0,Unknown,en,0.0
Cherokee Storm,Janelle Taylor,Zebra Books,2010-07-01,"A frontier woman finds love and safety in the arms of a Cherokee man in this Native American romance by the New York Times bestselling author. 1756. Traveling west with a small party, Shannon O'Shea loses her way in the frontier wilderness. Drenched by driving rains, she takes refuge in a cave and is drawn to the warmth of a fire deep within. There she finds a Cherokee brave, tall and broad-shouldered, scarcely clothed. Storm Dancer whispers that she knew him once. . .long ago. And he vows to keep her safe. By morning, Storm Dancer seems to have vanished. Yet he will remain with Shannon in every way—and awaken her every longing. She knows that Storm Dancer is far more honorable than the white man she must wed. But time will prove that only he can save her from violence and treachery, and that he is the only man she will truly love.",Fiction,400.0,0.0,0.0,0.0,Unknown,en,0.0
Wild Ecstasy,Cassie Edwards,Topaz,1992,"From the bestselling author of the Savage series comes this intense story of the undying love between a daring Chippewa brave and the beautiful daughter of an infamous Indian hater. Edwards is a winner of the Romantic Times Lifetime Achievement Award and its Reviewer's Choice Award for Best Indian Romance. Teaser chapter of Edwards' November Onyx title, Wild Rapture.",Fiction,358.0,0.0,0.0,0.0,Unknown,en,0.0
Savage Courage,Cassie Edwards,Leisure Books,2004-12-27,An Apache woman who was raised by whites strikes out on her own to find her true mother-and discovers true love instead.,Fiction,390.0,0.0,0.0,0.0,Unknown,en,0.0
Savage Passions,Cassie Edwards,Unknown,1996,"Living among the virgin forests of frontier Michigan, Yvonne secretly admires the cheiftain of a peaceful Ottawa tribe. A warrior with great mystical powers and many secrets, Silver Arrow tempts her heart. But white men and Indians alike threaten to keep them apart forever. Yvonne and Silver Arrow will need more than mere magic.",Fiction,458.0,0.0,0.0,0.0,Unknown,en,0.0
Savage Embers,Cassie Edwards,Leisure Books,1999,"Cassie Edwards has won the ""Romantic Times"" Lifetime Achievement Award and awards for Best Indian Series and Best Indian Romance. Even as Arapaho chieftain Falcon Hawk shelters the red-haired beauty in his embrace, an enemy waits to smother their searing ecstasy and leave them nothing but the embers of the love that might have been.",Fiction,448.0,0.0,0.0,0.0,Unknown,en,0.0
Savage Promise,Cassie Edwards,Unknown,1992,"When a silver-eyed warrior appears out of the driving snow to rescue her from a vicious polar bear, Letitia finds herself enthralled by Kanuga, who vows to rid Alaska of all white trappers. Letitia fears she might not survive in the frozen North alone, but Kanuga's fiery passion convinces her that she could never survive without him. Other titles available.",Fiction,452.0,0.0,0.0,0.0,Unknown,en,0.0
Flaming Arrow,Cassie Edwards,Signet Book,2008-01-02,"A beautiful young woman rides off into the wilderness alone, where she unexpectedly comes face to face with Flaming Arrow--an Indian warrior who has every reason to hate her. Her kind has driven his people from their home, and the last thing he needs is a woman whose beauty dazzles him, and whose awakening passion robs him of his reason. But a force greater than both of them has now brought them together and will ultimately transform both their lives.",Fiction,388.0,0.0,0.0,0.0,Unknown,en,0.0
Rapture's Rendezvous,Cassie Edwards,Zebra Books,1999-01-12,"When Maria leaves Italy on a ship to America, she has no idea she is about to meet the only man she will ever love. Michael is enraged by Nathan Hawkins' unjust treatment of immigrant coal miners, and is aboard the same ship to uncover information to end Hawkins' reign of terror. But when destiny brings Michael and Maria together, neither can foresee that Maria would be Hawkins' next pawn.",Fiction,472.0,5.0,1.0,0.0,Unknown,en,5.0
Tender Savage,Phoebe Conn,Splendor,1989-02-01,Unknown,Fiction,0.0,0.0,0.0,0.0,Unknown,en,0.0
Savage Mists,Cassie Edwards,Leisure Books,1992-08,"A virile, young Omaha chieftain retaliates against the government's abuse of his people by kidnapping a beautiful, innocent woman. At first recalcitrant, she soon vows to surmount any obstacle that threatens the man who has awakened her heart to love. Reissue.",Omaha Indians,446.0,0.0,0.0,0.0,Unknown,en,0.0
Wild Ecstacy,C. Edwards,Zebra Books,2016-09,"From the bestselling author of the Savage series comes this intense story of the undying love between a daring Chippewa brave and the beautiful daughter of an infamous Indian hater. Edwards is a winner of the Romantic Times Lifetime Achievement Award and its Reviewer's Choice Award for Best Indian Romance. Teaser chapter of Edwards' November Onyx title, Wild Rapture.",Chippewa County (Minn.),0.0,0.0,0.0,0.0,Unknown,en,0.0
Wild Embrace,Cassie Edwards,Topaz,1993,"For years, Cassie Edwards has been satisfying her fans with authentic tales of bold beauties, exotic braves and the untamed wilderness. Now the author of Wild Rapture captures a lost age of romance when Seattle was a rough frontier. Flame-haired Elizabeth is abducted by the noble Indian brave Strong Heart, who shows her freedom and passion the wilds can ignite.",Fiction,390.0,0.0,0.0,0.0,Unknown,en,0.0
Savage Persuasion,Cassie Edwards,Leisure Books,1995-08,"The award-winning Savage series is set on the untamed frontier, where rugged warriors share tantalizingly sensual adventures with young and innocent heroines. Lovely Brietta is captured by a Cherokee brave whose dark, smoldering eyes urge her to surrender. But Brave Eagle isn't the only Indian laying claim to her. . . .",Fiction,452.0,0.0,0.0,0.0,Unknown,en,0.0
Savage Eden,Cassie Edwards,Ace,1988,"Pamela and Strong Bear had a forbidden love. When a murderous tragedy struck her family, leaving only Strong Bear to blame, still her passion would not die. Together, their love would conquer all injustice.",Fiction,340.0,0.0,0.0,0.0,Unknown,en,0.0
Passion's Embrace,Cassie Edwards,Harlequin Treasury-Harlequin Historicals 90s,1990,"Passion's Embrace by Cassie Edwards released on Jan 25, 1990 is available now for purchase.",Fiction,308.0,0.0,0.0,0.0,Unknown,en,0.0
How to Escape an Arranged Marriage in High Heels,Tanima Kazi,Unknown,2015-05-08,"If marriage isn't in the immediate picture, what does Maya want to do with her life?Maya Khan wants no part of an arranged marriage. Unfortunately, she makes this discovery on the day of her wedding. Panicking, sweating, and swearing simultaneously, Maya escapes out the back window, scales down her parent's two story house in her big, flapping sari and lands on her best friend's sofa.In between working as a harem waitress, going back to college and finding out her new boyfriend is engaged to her arch rival from high school, she's still trying to figure it all out...and having the time of her life.",,272.0,0.0,0.0,0.0,Unknown,en,0.0
Roses After Rain,Cassie Edwards,Leisure Books,1990,Unknown,Fiction,452.0,0.0,0.0,0.0,Unknown,en,0.0
Cheyenne Captive,Georgina Gentry,Zebra Books,2014-05-16,"A beautiful blonde runaway falls for a handsome Native American captor in this epic historical romance series opener from a beloved author. SCANDALOUS THOUGHTS When headstrong, golden-haired Summer ran away from home, all she could think of was leaving her strict father behind. But after a vengeance-seeking Indian attacked her stage, threatening her with a fate worse than death, the tempestuous girl yarned for her parents’ overbearing rules . . . until the savage’s cruel grip changed to a tantalizing touch! His sensuous caress banished all ties to the past, the exciting things he did with his lips made her yearn for an unknown fulfillment. From that moment the spirited innocent knew that her future was bound to his—and she’d cherish whatever relationship the uncivilized brave decided to have with her. FORBIDDEN DESIRES From the years he was forced to live in Texas, the handsome half-breed Iron Knife knew how deceptive palefaces could be. Surely this creamy-skinned, blue-eyed beauty was no different. But even as he tried to brutally punish her for her heritage, he was ensnared by the hip-length strands of wheat-hued tresses, enchanted by the firm curves of her nubile white body. Before the ruthless warrior could control himself, he was whispering of love, swearing there’d be no others. He could never marry this ignoble slave, but he'd sooner slay her than ever give up his bewitching CHEYENNE CAPTIVE. “One of the finest writers of the decade.” —RT Book Reviews",Fiction,492.0,0.0,0.0,0.0,Unknown,en,0.0
Beloved Embrace,Cassie Edwards,Zebra Books,2008,"New York Times bestselling author Cassie Edwards captivates with this tale of a man and woman from two different worlds who embark on an unforgettable journey of adventure and passion on the high seas . . . From the moment Leana Rutherford's eyes meet the fierce gaze of the pirate keeping her captive, she realizes her life is about to change. For instead of fearing what the future may bring, she finds herself welcoming the chance to be held in the arms of a man who always gets what he wants . . . Abducted from his family as a young boy, Brandon Seton has only known the free and stormy seas of a pirate's life. But throughout his many voyages and conquests, he has never set eyes on a woman like Leana. Unfettered by land or law, his desire for her spirited beauty may put him at his greatest risk yet - but also bring him measureless riches . . .",Fiction,500.0,0.0,0.0,0.0,Unknown,en,0.0
Savage Sunrise,Cassie Edwards,Leisure Books,1995-08,Unknown,Fiction,452.0,0.0,0.0,0.0,Unknown,en,0.0
Savage Surrender,Cassie Edwards,Unknown,1996-05,"Strong willed Brenda has escaped her family's murderers, only to have her anguish and fury challenged by the savage wilderness. Her only hope for survival lay in the forceful arms of an Ojibwa warrior--the kind of man Brenda had been raised to fear.",Fiction,336.0,0.0,0.0,0.0,Unknown,en,0.0
Savage Intrigue,Cassie Edwards,Unknown,2007,"When a mysterious woman is accidentally shot near his village, Chief MidnightWolf of the Dakota tribe must decide whether she is a threat to his people orthe love of his life. Original.",Fiction,360.0,0.0,0.0,0.0,Unknown,en,0.0
Her Forbidden Pirate,Cassie Edwards,Zebra Books,2009,"When Rocco Volpe suggests Amber should be his mistress, she turns him down. But Amber quickly changes her mind – for her son Freddy's sake. Rocco might believe Amber had once betrayed him, but he still wants his baby son...and Amber!",Fiction,468.0,0.0,0.0,0.0,Unknown,en,0.0
Desire's Blossom,Cassie Edwards,Zebra Books,1999-11,The adopted daughter of a Chinese mandarin yearns to see the outside world. Her dreams are answered when an American businessman takes her on a voyage to America. His lingering kisses and warm embrace embolden Lee-Lee to face the hardships of the dangerous journey.,China,0.0,0.0,0.0,0.0,Unknown,en,0.0
Dance in My Heart,Marjorie Jones,Unknown,2015-04-13,"Sticks and stones... Candice Lincoln is waiting for her big break. Journalism, at least when it comes to war corresponding, is still a man's game. When she's handed a fluff story to cover a group of Native American dancers in the Midwest, the last thing she wants to do is drop everything and abandon her desk in the city. Hawk Manone is proud of himself and the people to which he was born. Sure, they have their problems from years of neglect, discrimination and overt hostility, but if they work together, he knows that his people can become proud again. That's why he volunteers his time as part of a dance team that helps to educate the white population as much as his own. He never thought his desire to teach the general population about his Nation would lead to falling in love with a woman as pure, and as white, as the driven snow. But then again... Even the snow isn't white once it gets dirty. And when it comes to journalism, apparently, ""dirty"" is the name of the game.",,210.0,0.0,0.0,0.0,Unknown,en,0.0
Half Breed's Bride,Georgina Gentry,Zebra Books,2014-05-16,"In Sioux Slave, Nevada Nights, Quicksilver Passion, and Apache Caress, Georgina Gentry captivated readers with her thrilling tales of action-packed romance, lusty adventure and sizzling passion. Teeming with the colorful history and vivid excitement of the American west, her stories are breathtaking journeys into a distant place and time—sure to capture your heart forever! HALF-BREED'S BRIDE Born dirt-poor, Sassy Malone had only her wits and wiles to get her by in life. So when tragedy struck her soon-to-be-wed employer, the feisty lass seized her chance: Armed with a new identity, she passed herself off as a high-class lady and boarded the ship bound west for the untamed Washington Territory—and an arranged marriage to a wealthy rancher. Though the all-too-virile Hunter made it all too clear that she was not the blushing bride he'd imagined, Sassy saw the searing desire in his eyes. She also knew something else: The big, dark loner harbored a savage secret. And as passions ignited in his scorching embrace and days of rapturous loving flamed into nights of unending wedded bliss, Sassy vowed she'd uncover his dangerous past. For her future belonged to this rugged, raven-haired lover who'd captured her very heart and soul! ""Nobody does it like Georgina Gentry does."" —Barbra Critiques",Fiction,356.0,0.0,0.0,0.0,Unknown,en,0.0
Savage Tears,Cassie Edwards,Leisure Books,1997,"Marjorie Zimmerman is fascinated by the Dakota Indians--especially their chief, Spotted Horse. When Spotted Horse saves her from her hated stepfather, Marjorie knows she loves him. But even as they ride to safety, enemies both Indian and white prepare to extinguish their passion. Reissue.",Fiction,406.0,0.0,0.0,0.0,Unknown,en,0.0
Gray Hawk's Lady,Karen Kay,Avon Books,1997,"Lady Genevieve Rohan has accompanied her father across the American continent as he completes his cultural study of Native American tribes. With only the elusive Blackfoot tribe left to record, Sir Rohan falls ill and is house-ridden. Determined to help her father realize his project, Genevieve heads West and, through some unorthodox methods, manages to enlist the aid of a Blackfoot brave who captures the lady's heart.",Fiction,388.0,0.0,0.0,0.0,Unknown,en,0.0
